### ISSUE TITLE
Apparent TCP packet loss reproducible with ICMP when the payload is strictly more than 1162 bytes (RKE2)

### ISSUE THREAD

**Issue by samy-mahmoudi** [loxilb-io/loxilb#976]
Hello all,

**Describe the bug**
Installing LoxiLB inside a Kubernetes cluster (RKE2) results in multiple network issues, e.g.:
* pods often taking ages to start due to inability to pull the corresponding images,
* `apt update` sometimes getting stuck at `0% [waiting for headers]` on the cluster nodes,
* intermittent etcd errors, e.g. `Error from server: etcdserver: request timed out` noticeable when using `kubectl` directly from the cluster nodes (`server: https://127.0.0.1:6443`)

**To Reproduce**

1. Launch an Ubuntu Noble (24.04) VM. (I created my reproducing VM with: `incus launch --vm images:ubuntu/24.04 rke2-3 --device eth0,ipv4.address=10.129.0.23 --device eth0,ipv6.address=fd00:10:129:0::23 --config limits.memory=8GiB --config limits.cpu=2 --device root,size=20GiB`.)
2. Install RKE2 (without starting the service): `curl -sfL https://get.rke2.io | sh -`
3. Configure RKE2:
```
cat <<EOF >/etc/rancher/rke2/config.yaml
cni: flannel
cluster-cidr: "10.42.0.0/16,2001:cafe:42::/56"
service-cidr: "10.43.0.0/16,2001:cafe:43::/112"
tls-san:
  - rke2.incus.janna.xxx.yyy.zzz
  - 10.129.0.20
etcd-expose-metrics: true
kube-apiserver-arg:
  - anonymous-auth=true
  - external-hostname=rke2-3.incus.janna.xxx.yyy.zzz
node-ip: 10.129.0.23,fd00:10:129::23
node-name: rke2-3.incus.janna.xxx.yyy.zzz
EOF
```
4. Start the RKE2 service.
5. Control the sanity of your network before installing LoxiLB (e.g., your ability to emit echo requests from your cluster node and receive echo replies successfully, or your ability to reply to echo requests emitted from your local network).
6. Install LoxiLB inside your single-node cluster and, optionally, `kube-loxilb`.
7. Run `tcpdump -ni any icmp and host 10.129.0.1` in one terminal of your RKE2 VM, where 10.129.0.1 is an other VM of your local network (I could also reproduce with 1.1.1.1 and 8.8.8.8).
8. Ping the other VM `10.129.0.1` (or the remote host 1.1.1.1/8.8.8.8) from your RKE2 VM:
```
ping 10.129.0.1 -c 10 -M do -s 1472
```
9. Observe the results in the two terminals (packet loss occurs if and only if `llb0` appears in the output of tcpdump with the P packet type: `packet addressed to other host`):
```
root@rke2-3:~# ping 10.129.0.1 -c 10 -M do -s 1472
PING 10.129.0.1 (10.129.0.1) 1472(1500) bytes of data.
1480 bytes from 10.129.0.1: icmp_seq=1 ttl=64 time=0.502 ms
1480 bytes from 10.129.0.1: icmp_seq=2 ttl=64 time=0.218 ms
1480 bytes from 10.129.0.1: icmp_seq=3 ttl=64 time=0.214 ms
1480 bytes from 10.129.0.1: icmp_seq=4 ttl=64 time=0.421 ms
1480 bytes from 10.129.0.1: icmp_seq=5 ttl=64 time=0.391 ms

--- 10.129.0.1 ping statistics ---
10 packets transmitted, 5 received, 50% packet loss, time 9199ms
rtt min/avg/max/mdev = 0.214/0.349/0.502/0.114 ms
```
```
root@rke2-3:~# tcpdump -ni any icmp and host 10.129.0.1
tcpdump: data link type LINUX_SLL2
tcpdump: verbose output suppressed, use -v[v]... for full protocol decode
listening on any, link-type LINUX_SLL2 (Linux cooked v2), snapshot length 262144 bytes
00:57:01.499556 enp5s0 Out IP 10.129.0.23 > 10.129.0.1: ICMP echo request, id 23489, seq 1, length 1480
00:57:01.499879 enp5s0 In  IP 10.129.0.1 > 10.129.0.23: ICMP echo reply, id 23489, seq 1, length 1480
00:57:02.499628 enp5s0 Out IP 10.129.0.23 > 10.129.0.1: ICMP echo request, id 23489, seq 2, length 1480
00:57:02.499809 enp5s0 In  IP 10.129.0.1 > 10.129.0.23: ICMP echo reply, id 23489, seq 2, length 1480
00:57:03.552754 enp5s0 Out IP 10.129.0.23 > 10.129.0.1: ICMP echo request, id 23489, seq 3, length 1480
00:57:03.552942 enp5s0 In  IP 10.129.0.1 > 10.129.0.23: ICMP echo reply, id 23489, seq 3, length 1480
00:57:04.576724 enp5s0 Out IP 10.129.0.23 > 10.129.0.1: ICMP echo request, id 23489, seq 4, length 1480
00:57:04.577055 enp5s0 In  IP 10.129.0.1 > 10.129.0.23: ICMP echo reply, id 23489, seq 4, length 1480
00:57:05.600828 enp5s0 Out IP 10.129.0.23 > 10.129.0.1: ICMP echo request, id 23489, seq 5, length 1480
00:57:05.601155 enp5s0 In  IP 10.129.0.1 > 10.129.0.23: ICMP echo reply, id 23489, seq 5, length 1480
00:57:06.601826 enp5s0 Out IP 10.129.0.23 > 10.129.0.1: ICMP echo request, id 23489, seq 6, length 1480
00:57:06.602217 enp5s0 In  IP 10.129.0.1 > 10.129.0.23: ICMP echo reply, id 23489, seq 6, length 1480
00:57:06.602217 llb0  P   IP 10.129.0.1 > 10.129.0.23: ICMP echo reply, id 23489, seq 6, length 1480
00:57:07.648759 enp5s0 Out IP 10.129.0.23 > 10.129.0.1: ICMP echo request, id 23489, seq 7, length 1480
00:57:07.648962 enp5s0 In  IP 10.129.0.1 > 10.129.0.23: ICMP echo reply, id 23489, seq 7, length 1480
00:57:07.648962 llb0  P   IP 10.129.0.1 > 10.129.0.23: ICMP echo reply, id 23489, seq 7, length 1480
00:57:08.672788 enp5s0 Out IP 10.129.0.23 > 10.129.0.1: ICMP echo request, id 23489, seq 8, length 1480
00:57:08.673068 enp5s0 In  IP 10.129.0.1 > 10.129.0.23: ICMP echo reply, id 23489, seq 8, length 1480
00:57:08.673068 llb0  P   IP 10.129.0.1 > 10.129.0.23: ICMP echo reply, id 23489, seq 8, length 1480
00:57:09.696815 enp5s0 Out IP 10.129.0.23 > 10.129.0.1: ICMP echo request, id 23489, seq 9, length 1480
00:57:09.697172 enp5s0 In  IP 10.129.0.1 > 10.129.0.23: ICMP echo reply, id 23489, seq 9, length 1480
00:57:09.697172 llb0  P   IP 10.129.0.1 > 10.129.0.23: ICMP echo reply, id 23489, seq 9, length 1480
00:57:10.698556 enp5s0 Out IP 10.129.0.23 > 10.129.0.1: ICMP echo request, id 23489, seq 10, length 1480
00:57:10.698832 enp5s0 In  IP 10.129.0.1 > 10.129.0.23: ICMP echo reply, id 23489, seq 10, length 1480
00:57:10.698832 llb0  P   IP 10.129.0.1 > 10.129.0.23: ICMP echo reply, id 23489, seq 10, length 1480
```
10. Reproduce at will with different settings/point of views (echo request to an external host):
```
root@rke2-3:~# ping 1.1.1.1 -c 10 -M do -s 1163
PING 1.1.1.1 (1.1.1.1) 1163(1191) bytes of data.
1171 bytes from 1.1.1.1: icmp_seq=7 ttl=59 time=30.1 ms

--- 1.1.1.1 ping statistics ---
10 packets transmitted, 1 received, 90% packet loss, time 9137ms
rtt min/avg/max/mdev = 30.074/30.074/30.074/0.000 ms
```
```
root@rke2-3:~# tcpdump -ni any icmp and host \(10.129.0.1 or 1.1.1.1 \)
tcpdump: data link type LINUX_SLL2
tcpdump: verbose output suppressed, use -v[v]... for full protocol decode
listening on any, link-type LINUX_SLL2 (Linux cooked v2), snapshot length 262144 bytes
04:14:07.584595 enp5s0 Out IP 10.129.0.23 > 1.1.1.1: ICMP echo request, id 7498, seq 1, length 1171
04:14:07.611738 enp5s0 In  IP 1.1.1.1 > 10.129.0.23: ICMP echo reply, id 7498, seq 1, length 1171
04:14:07.611738 llb0  P   IP 1.1.1.1 > 10.129.0.23: ICMP echo reply, id 7498, seq 1, length 1171
04:14:08.594917 enp5s0 Out IP 10.129.0.23 > 1.1.1.1: ICMP echo request, id 7498, seq 2, length 1171
04:14:08.623311 enp5s0 In  IP 1.1.1.1 > 10.129.0.23: ICMP echo reply, id 7498, seq 2, length 1171
04:14:08.623311 llb0  P   IP 1.1.1.1 > 10.129.0.23: ICMP echo reply, id 7498, seq 2, length 1171
04:14:09.618223 enp5s0 Out IP 10.129.0.23 > 1.1.1.1: ICMP echo request, id 7498, seq 3, length 1171
04:14:09.640491 enp5s0 In  IP 1.1.1.1 > 10.129.0.23: ICMP echo reply, id 7498, seq 3, length 1171
04:14:09.640491 llb0  P   IP 1.1.1.1 > 10.129.0.23: ICMP echo reply, id 7498, seq 3, length 1171
04:14:10.642253 enp5s0 Out IP 10.129.0.23 > 1.1.1.1: ICMP echo request, id 7498, seq 4, length 1171
04:14:10.672190 enp5s0 In  IP 1.1.1.1 > 10.129.0.23: ICMP echo reply, id 7498, seq 4, length 1171
04:14:10.672190 llb0  P   IP 1.1.1.1 > 10.129.0.23: ICMP echo reply, id 7498, seq 4, length 1171
04:14:11.642253 enp5s0 Out IP 10.129.0.23 > 1.1.1.1: ICMP echo request, id 7498, seq 5, length 1171
04:14:11.665165 enp5s0 In  IP 1.1.1.1 > 10.129.0.23: ICMP echo reply, id 7498, seq 5, length 1171
04:14:11.665165 llb0  P   IP 1.1.1.1 > 10.129.0.23: ICMP echo reply, id 7498, seq 5, length 1171
04:14:12.690350 enp5s0 Out IP 10.129.0.23 > 1.1.1.1: ICMP echo request, id 7498, seq 6, length 1171
04:14:12.720404 enp5s0 In  IP 1.1.1.1 > 10.129.0.23: ICMP echo reply, id 7498, seq 6, length 1171
04:14:12.720404 llb0  P   IP 1.1.1.1 > 10.129.0.23: ICMP echo reply, id 7498, seq 6, length 1171
04:14:13.714375 enp5s0 Out IP 10.129.0.23 > 1.1.1.1: ICMP echo request, id 7498, seq 7, length 1171
04:14:13.744374 enp5s0 In  IP 1.1.1.1 > 10.129.0.23: ICMP echo reply, id 7498, seq 7, length 1171
04:14:14.716148 enp5s0 Out IP 10.129.0.23 > 1.1.1.1: ICMP echo request, id 7498, seq 8, length 1171
04:14:14.738201 enp5s0 In  IP 1.1.1.1 > 10.129.0.23: ICMP echo reply, id 7498, seq 8, length 1171
04:14:14.738201 llb0  P   IP 1.1.1.1 > 10.129.0.23: ICMP echo reply, id 7498, seq 8, length 1171
04:14:15.716146 enp5s0 Out IP 10.129.0.23 > 1.1.1.1: ICMP echo request, id 7498, seq 9, length 1171
04:14:15.735771 enp5s0 In  IP 1.1.1.1 > 10.129.0.23: ICMP echo reply, id 7498, seq 9, length 1171
04:14:15.735771 llb0  P   IP 1.1.1.1 > 10.129.0.23: ICMP echo reply, id 7498, seq 9, length 1171
04:14:16.722177 enp5s0 Out IP 10.129.0.23 > 1.1.1.1: ICMP echo request, id 7498, seq 10, length 1171
04:14:16.741575 enp5s0 In  IP 1.1.1.1 > 10.129.0.23: ICMP echo reply, id 7498, seq 10, length 1171
04:14:16.741575 llb0  P   IP 1.1.1.1 > 10.129.0.23: ICMP echo reply, id 7498, seq 10, length 1171
```
11. Reproduce at will with different settings/point of views (echo request from a host of the same network to the VIP of the single-node cluster RKE2 node):
```
root@puppet-jammy:~# ping 10.129.0.20 -c 10 -M do -s 1163
PING 10.129.0.20 (10.129.0.20) 1163(1191) bytes of data.
1171 bytes from 10.129.0.20: icmp_seq=8 ttl=64 time=0.451 ms

--- 10.129.0.20 ping statistics ---
10 packets transmitted, 1 received, 90% packet loss, time 9119ms
rtt min/avg/max/mdev = 0.451/0.451/0.451/0.000 ms
```
```
root@rke2-3:~# tcpdump -ni any icmp and host \(10.129.0.1 or 1.1.1.1 \)
tcpdump: data link type LINUX_SLL2
tcpdump: verbose output suppressed, use -v[v]... for full protocol decode
listening on any, link-type LINUX_SLL2 (Linux cooked v2), snapshot length 262144 bytes
04:16:18.065323 enp5s0 In  IP 10.129.0.1 > 10.129.0.20: ICMP echo request, id 57022, seq 1, length 1171
04:16:18.065323 llb0  P   IP 10.129.0.1 > 10.129.0.20: ICMP echo request, id 57022, seq 1, length 1171
04:16:19.077204 enp5s0 In  IP 10.129.0.1 > 10.129.0.20: ICMP echo request, id 57022, seq 2, length 1171
04:16:19.077204 llb0  P   IP 10.129.0.1 > 10.129.0.20: ICMP echo request, id 57022, seq 2, length 1171
04:16:20.090676 enp5s0 In  IP 10.129.0.1 > 10.129.0.20: ICMP echo request, id 57022, seq 3, length 1171
04:16:20.090676 llb0  P   IP 10.129.0.1 > 10.129.0.20: ICMP echo request, id 57022, seq 3, length 1171
04:16:21.104070 enp5s0 In  IP 10.129.0.1 > 10.129.0.20: ICMP echo request, id 57022, seq 4, length 1171
04:16:21.104070 llb0  P   IP 10.129.0.1 > 10.129.0.20: ICMP echo request, id 57022, seq 4, length 1171
04:16:22.120498 enp5s0 In  IP 10.129.0.1 > 10.129.0.20: ICMP echo request, id 57022, seq 5, length 1171
04:16:22.120498 llb0  P   IP 10.129.0.1 > 10.129.0.20: ICMP echo request, id 57022, seq 5, length 1171
04:16:23.130739 enp5s0 In  IP 10.129.0.1 > 10.129.0.20: ICMP echo request, id 57022, seq 6, length 1171
04:16:23.130739 llb0  P   IP 10.129.0.1 > 10.129.0.20: ICMP echo request, id 57022, seq 6, length 1171
04:16:24.143807 enp5s0 In  IP 10.129.0.1 > 10.129.0.20: ICMP echo request, id 57022, seq 7, length 1171
04:16:24.143807 llb0  P   IP 10.129.0.1 > 10.129.0.20: ICMP echo request, id 57022, seq 7, length 1171
04:16:25.160702 enp5s0 In  IP 10.129.0.1 > 10.129.0.20: ICMP echo request, id 57022, seq 8, length 1171
04:16:25.160861 enp5s0 Out IP 10.129.0.20 > 10.129.0.1: ICMP echo reply, id 57022, seq 8, length 1171
04:16:26.170746 enp5s0 In  IP 10.129.0.1 > 10.129.0.20: ICMP echo request, id 57022, seq 9, length 1171
04:16:26.170746 llb0  P   IP 10.129.0.1 > 10.129.0.20: ICMP echo request, id 57022, seq 9, length 1171
04:16:27.184192 enp5s0 In  IP 10.129.0.1 > 10.129.0.20: ICMP echo request, id 57022, seq 10, length 1171
04:16:27.184192 llb0  P   IP 10.129.0.1 > 10.129.0.20: ICMP echo request, id 57022, seq 10, length 1171
```
12. Reproduce at will with different settings/point of views (echo request from a host of the same network to the node IP of the single-node cluster RKE2 node):
```
root@puppet-jammy:~# ping 10.129.0.23 -c 10 -M do -s 1163
PING 10.129.0.23 (10.129.0.23) 1163(1191) bytes of data.

--- 10.129.0.23 ping statistics ---
10 packets transmitted, 0 received, 100% packet loss, time 9117ms
```
```
root@rke2-3:~# tcpdump -ni any icmp and host \(10.129.0.1 or 1.1.1.1 \)
tcpdump: data link type LINUX_SLL2
tcpdump: verbose output suppressed, use -v[v]... for full protocol decode
listening on any, link-type LINUX_SLL2 (Linux cooked v2), snapshot length 262144 bytes
04:19:44.175254 enp5s0 In  IP 10.129.0.1 > 10.129.0.23: ICMP echo request, id 49621, seq 1, length 1171
04:19:44.175254 llb0  P   IP 10.129.0.1 > 10.129.0.23: ICMP echo request, id 49621, seq 1, length 1171
04:19:45.182399 enp5s0 In  IP 10.129.0.1 > 10.129.0.23: ICMP echo request, id 49621, seq 2, length 1171
04:19:45.182399 llb0  P   IP 10.129.0.1 > 10.129.0.23: ICMP echo request, id 49621, seq 2, length 1171
04:19:46.198687 enp5s0 In  IP 10.129.0.1 > 10.129.0.23: ICMP echo request, id 49621, seq 3, length 1171
04:19:46.198687 llb0  P   IP 10.129.0.1 > 10.129.0.23: ICMP echo request, id 49621, seq 3, length 1171
04:19:47.212231 enp5s0 In  IP 10.129.0.1 > 10.129.0.23: ICMP echo request, id 49621, seq 4, length 1171
04:19:47.212231 llb0  P   IP 10.129.0.1 > 10.129.0.23: ICMP echo request, id 49621, seq 4, length 1171
04:19:48.222304 enp5s0 In  IP 10.129.0.1 > 10.129.0.23: ICMP echo request, id 49621, seq 5, length 1171
04:19:48.222304 llb0  P   IP 10.129.0.1 > 10.129.0.23: ICMP echo request, id 49621, seq 5, length 1171
04:19:49.238906 enp5s0 In  IP 10.129.0.1 > 10.129.0.23: ICMP echo request, id 49621, seq 6, length 1171
04:19:49.238906 llb0  P   IP 10.129.0.1 > 10.129.0.23: ICMP echo request, id 49621, seq 6, length 1171
04:19:50.252159 enp5s0 In  IP 10.129.0.1 > 10.129.0.23: ICMP echo request, id 49621, seq 7, length 1171
04:19:50.252159 llb0  P   IP 10.129.0.1 > 10.129.0.23: ICMP echo request, id 49621, seq 7, length 1171
04:19:51.262338 enp5s0 In  IP 10.129.0.1 > 10.129.0.23: ICMP echo request, id 49621, seq 8, length 1171
04:19:51.262338 llb0  P   IP 10.129.0.1 > 10.129.0.23: ICMP echo request, id 49621, seq 8, length 1171
04:19:52.275601 enp5s0 In  IP 10.129.0.1 > 10.129.0.23: ICMP echo request, id 49621, seq 9, length 1171
04:19:52.275601 llb0  P   IP 10.129.0.1 > 10.129.0.23: ICMP echo request, id 49621, seq 9, length 1171
04:19:53.292030 enp5s0 In  IP 10.129.0.1 > 10.129.0.23: ICMP echo request, id 49621, seq 10, length 1171
04:19:53.292030 llb0  P   IP 10.129.0.1 > 10.129.0.23: ICMP echo request, id 49621, seq 10, length 1171
```
13. Observe the lack of packet loss when changing the packet size from 1163 to 1162 (I am only giving one example but the packets are also not lost anymore when receiving echo request to the VIP or when emitting echo request to an external host like 1.1.1.1):
```
root@puppet-jammy:~# ping 10.129.0.23 -c 10 -M do -s 1162
PING 10.129.0.23 (10.129.0.23) 1162(1190) bytes of data.
1170 bytes from 10.129.0.23: icmp_seq=1 ttl=64 time=0.428 ms
1170 bytes from 10.129.0.23: icmp_seq=2 ttl=64 time=0.514 ms
1170 bytes from 10.129.0.23: icmp_seq=3 ttl=64 time=0.506 ms
1170 bytes from 10.129.0.23: icmp_seq=4 ttl=64 time=0.553 ms
1170 bytes from 10.129.0.23: icmp_seq=5 ttl=64 time=0.377 ms
1170 bytes from 10.129.0.23: icmp_seq=6 ttl=64 time=0.441 ms
1170 bytes from 10.129.0.23: icmp_seq=7 ttl=64 time=0.545 ms
1170 bytes from 10.129.0.23: icmp_seq=8 ttl=64 time=0.514 ms
1170 bytes from 10.129.0.23: icmp_seq=9 ttl=64 time=0.586 ms
1170 bytes from 10.129.0.23: icmp_seq=10 ttl=64 time=0.559 ms

--- 10.129.0.23 ping statistics ---
10 packets transmitted, 10 received, 0% packet loss, time 9113ms
rtt min/avg/max/mdev = 0.377/0.502/0.586/0.063 ms
```
```
root@rke2-3:~# tcpdump -ni any icmp and host \(10.129.0.1 or 1.1.1.1 \)
tcpdump: data link type LINUX_SLL2
tcpdump: verbose output suppressed, use -v[v]... for full protocol decode
listening on any, link-type LINUX_SLL2 (Linux cooked v2), snapshot length 262144 bytes
04:24:03.774722 enp5s0 In  IP 10.129.0.1 > 10.129.0.23: ICMP echo request, id 53971, seq 1, length 1170
04:24:03.774884 enp5s0 Out IP 10.129.0.23 > 10.129.0.1: ICMP echo reply, id 53971, seq 1, length 1170
04:24:04.781344 enp5s0 In  IP 10.129.0.1 > 10.129.0.23: ICMP echo request, id 53971, seq 2, length 1170
04:24:04.781555 enp5s0 Out IP 10.129.0.23 > 10.129.0.1: ICMP echo reply, id 53971, seq 2, length 1170
04:24:05.794669 enp5s0 In  IP 10.129.0.1 > 10.129.0.23: ICMP echo request, id 53971, seq 3, length 1170
04:24:05.794888 enp5s0 Out IP 10.129.0.23 > 10.129.0.1: ICMP echo reply, id 53971, seq 3, length 1170
04:24:06.808157 enp5s0 In  IP 10.129.0.1 > 10.129.0.23: ICMP echo request, id 53971, seq 4, length 1170
04:24:06.808343 enp5s0 Out IP 10.129.0.23 > 10.129.0.1: ICMP echo reply, id 53971, seq 4, length 1170
04:24:07.821218 enp5s0 In  IP 10.129.0.1 > 10.129.0.23: ICMP echo request, id 53971, seq 5, length 1170
04:24:07.821391 enp5s0 Out IP 10.129.0.23 > 10.129.0.1: ICMP echo reply, id 53971, seq 5, length 1170
04:24:08.834604 enp5s0 In  IP 10.129.0.1 > 10.129.0.23: ICMP echo request, id 53971, seq 6, length 1170
04:24:08.834816 enp5s0 Out IP 10.129.0.23 > 10.129.0.1: ICMP echo reply, id 53971, seq 6, length 1170
04:24:09.848076 enp5s0 In  IP 10.129.0.1 > 10.129.0.23: ICMP echo request, id 53971, seq 7, length 1170
04:24:09.848261 enp5s0 Out IP 10.129.0.23 > 10.129.0.1: ICMP echo reply, id 53971, seq 7, length 1170
04:24:10.861511 enp5s0 In  IP 10.129.0.1 > 10.129.0.23: ICMP echo request, id 53971, seq 8, length 1170
04:24:10.861718 enp5s0 Out IP 10.129.0.23 > 10.129.0.1: ICMP echo reply, id 53971, seq 8, length 1170
04:24:11.878070 enp5s0 In  IP 10.129.0.1 > 10.129.0.23: ICMP echo request, id 53971, seq 9, length 1170
04:24:11.878266 enp5s0 Out IP 10.129.0.23 > 10.129.0.1: ICMP echo reply, id 53971, seq 9, length 1170
04:24:12.888044 enp5s0 In  IP 10.129.0.1 > 10.129.0.23: ICMP echo request, id 53971, seq 10, length 1170
04:24:12.888228 enp5s0 Out IP 10.129.0.23 > 10.129.0.1: ICMP echo reply, id 53971, seq 10, length 1170
```

**Expected behavior**
Packet loss should be two to three orders of magnitude lower. 

**Screenshots**
Not applicable.

**Environment (please complete the following information):**
 - OS: Host: Arch Linux, Guest (VM): Ubuntu 24.04
 - Kernel Version: Host: `6.12.13-1-lts`, Guest (VM): `6.8.0-53-generic` / `6.11.0-17-generic` (could reproduce the issue with the two Ubuntu kernels)
 - LoxiLB Version:
```
    Image:         ghcr.io/loxilb-io/loxilb:latest
    Image ID:      ghcr.io/loxilb-io/loxilb@sha256:2f187446f02c265da9c3ebfb486a8b112c1126820a50b159b8ac98e354e673b2
```
```
root@rke2-3:~# kubectl -n kube-system exec -it $pod -- loxicmd version
Loxicmd version: 0.9.7-beta
Loxicmd build info: 2025_02_20-main-f0f1eb3
```
 - Cloud Environment: On-prem.
 - K8s Version: `v1.31.5+rke2r1`

**Additional context**
Issue originally encountered with a three-node cluster running `canal` (Flannel + Calico network policies) as a CNI. `kubectl -n kube-system exec -it $pod -- loxicmd get ep` was also showing some intermittent flipping of the state of the two remote endpoints, in addition to the other network issues described.

Thank you for reading.

**Comment by inhogog2** [comment]
Hi @samy-mahmoudi. By default, Loxilb does not include rules for internet masquerading. Adding the `--fallback` option to the Loxilb arguments should resolve internet connectivity issues, as mentioned [here](https://github.com/loxilb-io/loxilb/discussions/856).
Regarding packet drops when exceeding a certain length, this issue is typically observed with non-TCP traffic when using a KVM interface, particularly if the hypervisor's kernel version is outdated. Nonetheless, I will triage in similar Ubuntu versions and provide an update.

**Comment by samy-mahmoudi** [comment]
Hi again all,

The issue seems to persist in my reproducing environment, even with `--fallback` and `ghcr.io/loxilb-io/loxilb@sha256:aeee1582a8adb7d686ddd066e9ed2028d0f89cb77a9e4b97f83e776256d2e904`:
```
root@rke2-3:~# pod="$(kubectl get pods -A -o wide | grep loxilb-lb | grep `hostname` | awk '{print $2}')"
```
```
root@rke2-3:~# kubectl describe pod $pod -n kube-system
Name:             loxilb-lb-796m8
Namespace:        kube-system
Priority:         0
Service Account:  default
Node:             rke2-3.incus.janna.xxx.yyy.zzz/10.129.0.23
Start Time:       Wed, 26 Feb 2025 01:30:28 +0000
Labels:           app=loxilb-app
                  controller-revision-hash=57df6456d7
                  pod-template-generation=3
Annotations:      <none>
Status:           Running
IP:               10.129.0.23
IPs:
  IP:           10.129.0.23
  IP:           fd00:10:129::23
Controlled By:  DaemonSet/loxilb-lb
Containers:
  loxilb-app:
    Container ID:  containerd://0d26f5def8084c2330b8fd29a5570c85525d20180679d98ecc83779179cfd463
    Image:         ghcr.io/loxilb-io/loxilb:latest
    Image ID:      ghcr.io/loxilb-io/loxilb@sha256:aeee1582a8adb7d686ddd066e9ed2028d0f89cb77a9e4b97f83e776256d2e904
    Ports:         11111/TCP, 179/TCP
    Host Ports:    11111/TCP, 179/TCP
    Command:
      /root/loxilb-io/loxilb/loxilb
    Args:
      --egr-hooks
      --blacklist=cni[0-9a-z]|veth.|flannel.|flannel-v6.|cali.
      --fallback
    State:          Running
      Started:      Wed, 26 Feb 2025 01:30:28 +0000
    Ready:          True
    Restart Count:  0
    Environment:    <none>
    Mounts:
      /etc/loxilb from hllb (rw)
      /opt/loxilb/cert from certforhllb (rw)
      /var/run/secrets/kubernetes.io/serviceaccount from kube-api-access-s467t (ro)
Conditions:
  Type                        Status
  PodReadyToStartContainers   True 
  Initialized                 True 
  Ready                       True 
  ContainersReady             True 
  PodScheduled                True 
Volumes:
  hllb:
    Type:          HostPath (bare host directory volume)
    Path:          /etc/loxilb
    HostPathType:  DirectoryOrCreate
  certforhllb:
    Type:          HostPath (bare host directory volume)
    Path:          /opt/loxilb/cert
    HostPathType:  DirectoryOrCreate
  kube-api-access-s467t:
    Type:                    Projected (a volume that contains injected data from multiple sources)
    TokenExpirationSeconds:  3607
    ConfigMapName:           kube-root-ca.crt
    ConfigMapOptional:       <nil>
    DownwardAPI:             true
QoS Class:                   BestEffort
Node-Selectors:              <none>
Tolerations:                 node-role.kubernetes.io/control-plane op=Exists
                             node.kubernetes.io/disk-pressure:NoSchedule op=Exists
                             node.kubernetes.io/memory-pressure:NoSchedule op=Exists
                             node.kubernetes.io/network-unavailable:NoSchedule op=Exists
                             node.kubernetes.io/not-ready:NoExecute op=Exists
                             node.kubernetes.io/pid-pressure:NoSchedule op=Exists
                             node.kubernetes.io/unreachable:NoExecute op=Exists
                             node.kubernetes.io/unschedulable:NoSchedule op=Exists
Events:
  Type    Reason     Age    From               Message
  ----    ------     ----   ----               -------
  Normal  Scheduled  9m25s  default-scheduler  Successfully assigned kube-system/loxilb-lb-796m8 to rke2-3.incus.janna.xxx.yyy.zzz
  Normal  Pulling    9m25s  kubelet            Pulling image "ghcr.io/loxilb-io/loxilb:latest"
  Normal  Pulled     9m25s  kubelet            Successfully pulled image "ghcr.io/loxilb-io/loxilb:latest" in 395ms (395ms including waiting). Image size: 126055851 bytes.
  Normal  Created    9m25s  kubelet            Created container loxilb-app
  Normal  Started    9m25s  kubelet            Started container loxilb-app
```
```
root@rke2-3:~# ping 1.1.1.1 -c 10 -M do -s 1472
PING 1.1.1.1 (1.1.1.1) 1472(1500) bytes of data.
1480 bytes from 1.1.1.1: icmp_seq=10 ttl=59 time=20.3 ms

--- 1.1.1.1 ping statistics ---
10 packets transmitted, 1 received, 90% packet loss, time 9220ms
rtt min/avg/max/mdev = 20.289/20.289/20.289/0.000 ms
```

Sending only one packet to ease in analyzing the subsequent output: tcpdump run from the guest machine and from the host machine, respectively:
```
root@rke2-3:~# ping -4 1.1.1.1 -c 1 -M do -s 1472
PING 1.1.1.1 (1.1.1.1) 1472(1500) bytes of data.

--- 1.1.1.1 ping statistics ---
1 packets transmitted, 0 received, 100% packet loss, time 0ms
```
```
root@rke2-3:~# tcpdump -ni any icmp and host 1.1.1.1
tcpdump: data link type LINUX_SLL2
tcpdump: verbose output suppressed, use -v[v]... for full protocol decode
listening on any, link-type LINUX_SLL2 (Linux cooked v2), snapshot length 262144 bytes
03:25:44.177134 enp5s0 Out IP 10.129.0.23 > 1.1.1.1: ICMP echo request, id 57130, seq 1, length 1480
03:25:44.200474 enp5s0 In  IP 1.1.1.1 > 10.129.0.23: ICMP echo reply, id 57130, seq 1, length 1480
03:25:44.200474 llb0  In  IP 1.1.1.1 > 10.129.0.23: ICMP echo reply, id 57130, seq 1, length 1480
```
```
[0]samy@janna:/home/samy$ sudo tcpdump -ni any icmp and host 1.1.1.1
tcpdump: WARNING: any: That device doesn't support promiscuous mode
(Promiscuous mode not supported on the "any" device)
tcpdump: verbose output suppressed, use -v[v]... for full protocol decode
listening on any, link-type LINUX_SLL2 (Linux cooked v2), snapshot length 262144 bytes
22:26:15.413799 tap952818fa P   IP 10.129.0.23 > 1.1.1.1: ICMP echo request, id 57130, seq 1, length 1480
22:26:15.413799 incusbr-1001 In  IP 10.129.0.23 > 1.1.1.1: ICMP echo request, id 57130, seq 1, length 1480
22:26:15.413903 wlo1  Out IP 192.168.0.3 > 1.1.1.1: ICMP echo request, id 57130, seq 1, length 1480
22:26:15.436591 wlo1  In  IP 1.1.1.1 > 192.168.0.3: ICMP echo reply, id 57130, seq 1, length 1480
22:26:15.436663 incusbr-1001 Out IP 1.1.1.1 > 10.129.0.23: ICMP echo reply, id 57130, seq 1, length 1480
22:26:15.436679 tap952818fa Out IP 1.1.1.1 > 10.129.0.23: ICMP echo reply, id 57130, seq 1, length 1480
```

**Comment by TrekkieCoder** [comment]
I tested in a setup same as yours Ubuntu24.04 as host and Ubuntu24.04 as VM. And I was able to reproduce this issue. The solution to this for me was to simply set the following in the VM - 

```
sysctl -w net.ipv4.conf.all.rp_filter=0
```

**Comment by TrekkieCoder** [comment]
Hi @samy-mahmoudi ,

The issue should be now resolved in latest image without the need setting any sysctl. Please give it a try.

**Comment by TrekkieCoder** [comment]
Thanks for reporting. Closing this.
