### ISSUE TITLE
loxilb 0.9.8 seems breaking firewall masquerade (SNAT) functionality

### ISSUE THREAD

**Issue by vincentmli** [loxilb-io/loxilb#957]
**Describe the bug**

after upgrading loxilb to 0.9.8 on BPFire and enable loxilb, loxilb stops masquerading (snatting) BPFire green network source IP, result in green network egress Internet connection failing

loxilb firewall rule for masquerading/snatting

```
[root@bpfire-demo loxilb]# cat FWconfig.txt 
{"fwAttr":[{"opts":{"counter":"0:0","doSnat":true,"toIP":"10.0.0.46"},"ruleArguments":{"destinationIP":"0.0.0.0/0","portName":"green0","sourceIP":"0.0.0.0/0"}}]}

[root@bpfire-demo loxilb]# loxicmd get fw
| SOURCE IP | DESTINATION IP | MIN SPORT | MAX SPORT | MIN DPORT | MAX DPORT | PROTOCOL | PORT NAME | PREFERENCE |      OPTION       | COUNTERS  |
|-----------|----------------|-----------|-----------|-----------|-----------|----------|-----------|------------|-------------------|-----------|
| 0.0.0.0/0 | 0.0.0.0/0      |         0 |         0 |         0 |         0 |        0 | green0    |          0 | Snat(10.0.0.46:0) | 421:40882 |

```
tcpdump on BPFire red0 (Internet) interface shows source IP `172.16.3.11`  from green network is not masqueraded/SNATTed to `10.0.0.46`

```
[root@bpfire-demo loxilb]# tcpdump -nn -i red0 icmp
tcpdump: verbose output suppressed, use -v[v]... for full protocol decode
listening on red0, link-type EN10MB (Ethernet), snapshot length 262144 bytes

11:33:15.813340 IP 172.16.3.11 > 142.251.46.196: ICMP echo request, id 61399, seq 16, length 64
11:33:16.819178 IP 172.16.3.11 > 142.251.46.196: ICMP echo request, id 61399, seq 17, length 64

```

similar function works in https://github.com/loxilb-io/loxilb/issues/718#issuecomment-2211826294 that the firewall masquerade feature is developed.

**To Reproduce**

**Expected behavior**
expect loxilb 0.9.8 performs source IP masquerading for egress traffic initiated from green or internal network

**Screenshots**

**Environment (please complete the following information):**
 - OS: BPFire
 - Kernel Version: 6.10.11
 - LoxiLB Version: 0.9.8

**Additional context**
Add any other context or topology about the problem here.

**Comment by TrekkieCoder** [comment]
To support [egress](https://github.com/loxilb-io/loxilb/issues/877) functionality in v0.9.8,  there has been a change in IP masquerading configuration as follows - 

```
loxicmd create firewall --firewallRule="portName:ens0p3" --snat=172.17.0.3 --egress
```

**Comment by vincentmli** [comment]
> loxicmd create firewall --firewallRule="portName:ens0p3" --snat=172.17.0.3 --egress

 I tried `loxicmd create firewall --firewallRule="portName:green0" --snat=10.0.0.46 --egress`, SNAT  is working for host on the Internet, for example `www.bpfire.net`, but no SNAT for network `10.0.0.0/24` for my red0 network

I see there is addition of `Egr` in the `OPTION` field

```
[root@bpfire-demo ~]# loxicmd get fw
| SOURCE IP | DESTINATION IP | MIN SPORT | MAX SPORT | MIN DPORT | MAX DPORT | PROTOCOL | PORT NAME | PREFERENCE |        OPTION         |   COUNTERS    |
|-----------|----------------|-----------|-----------|-----------|-----------|----------|-----------|------------|-----------------------|---------------|
| 0.0.0.0/0 | 0.0.0.0/0      |         0 |         0 |         0 |         0 |        0 | green0    |          0 | Snat(10.0.0.46:0),Egr | 21471:6193318 |
```

for example ping host `www.bpfire.net` on Internet

```
% ping www.bpfire.net -c 1
PING www.bpfire.net (178.128.19.186): 56 data bytes
64 bytes from 178.128.19.186: icmp_seq=0 ttl=46 time=205.930 ms
```

ping host in `10.0.0.0/24` 

```
% ping 10.0.0.1 -c 1
PING 10.0.0.1 (10.0.0.1): 56 data bytes

--- 10.0.0.1 ping statistics ---
1 packets transmitted, 0 packets received, 100.0% packet loss
```

no SNAT for `10.0.0.1` from tcpdump

```
[root@bpfire-demo ~]# tcpdump -nn -i red0 icmp

tcpdump: verbose output suppressed, use -v[v]... for full protocol decode
listening on red0, link-type EN10MB (Ethernet), snapshot length 262144 bytes
18:58:32.105488 IP 172.16.3.11 > 10.0.0.1: ICMP echo request, id 2580, seq 0, length 64

```

**Comment by inhogog2** [comment]
Hi @vincentmli 

When going to internet, SNAT will work if the `egress` flag is used, but when using SNAT internally, the egress flag should not be used. Can you add an additional firewall rule without `egress` flag for 10.0.0.0/24 and test it?

**Comment by vincentmli** [comment]
I tried following, doesn't work, I recall previous version 0.96 with one firewall rule would work for both.

```
   98  loxicmd create firewall --firewallRule="destinationIP:10.0.0.0/24,portName:green0" --snat=10.0.0.46
   99  loxicmd get fw
  100  loxicmd delete firewall --firewallRule="destinationIP:10.0.0.0/24,portName:green0" --snat=10.0.0.46
  101  loxicmd delete firewall --firewallRule="destinationIP:10.0.0.0/24,portName:green0"
  102  loxicmd create firewall --firewallRule="destinationIP:10.0.0.0/24,portName:red0" --snat=10.0.0.46
  103  loxicmd get fw
  105  loxicmd delete firewall --firewallRule="destinationIP:10.0.0.0/24,portName:red0" --snat=10.0.0.46
  106  loxicmd delete firewall --firewallRule="destinationIP:10.0.0.0/24,portName:red0"
  107  history | grep loxicmd

[root@bpfire-demo ~]# loxicmd create firewall --firewallRule="portName:green0" --snat=10.0.0.46
Debug: response.StatusCode: 200
fwrule-exists error
```

**Comment by vincentmli** [comment]
it looks following rule works

`loxicmd create firewall --firewallRule="destinationIP:10.0.0.0/24,preference:200" --snat=10.0.0.46`

remove the `preference:200`, doesn't work
