### ISSUE TITLE
SCTP [ABORT] responses from LoxiLB when initiating connection over AWS Transit GW GRE + BGP setup

### ISSUE THREAD

**Issue by infinitydon** [loxilb-io/loxilb#995]
Hi LoxiLB team,

We're seeing repeated SCTP [ABORT] responses when trying to initiate SCTP connections through LoxiLB. Below is the network topology and tcpdump output for context.

🗺️ Topology Overview
```
+--------+       +--------+         [GRE Tunnel]         +-------------------+         +-----------------------------+
|  gNB   |  ---> |  TGW   | ============================> |     LoxiLB        |  -----> |            AMF             |
|        |       |  BGP   |                               |       BGP         |         |  [10.10.2.17, 10.10.2.18]   |
|        |       +--------+                               | VIP: 20.20.20.1   |         +-----------------------------+
|        |                                               |      10.10.2.20    |
+--------+                                               +-------------------+
```

🧪 Observed Behavior (tcpdump from LoxiLB node):

```
14:31:37.002404 IP ip-10-20-2-145.ec2.internal.56784 > 20.20.20.1.38412: sctp (1) [INIT] [init tag: 486214072] [rwnd: 106496] [OS: 10] [MIS: 10] [init TSN: 2114652233]
14:31:37.002468 IP 20.20.20.1.38412 > ip-10-20-2-145.ec2.internal.56784: sctp (1) [ABORT]
14:31:37.003460 IP ip-10-20-2-145.ec2.internal.56784 > 20.20.20.1.38412: sctp (1) [INIT] [init tag: 4073524286] [rwnd: 106496] [OS: 10] [MIS: 10] [init TSN: 3369907879]
14:31:37.003491 IP 20.20.20.1.38412 > ip-10-20-2-145.ec2.internal.56784: sctp (1) [ABORT]
14:31:37.004093 IP ip-10-20-2-145.ec2.internal.56784 > 20.20.20.1.38412: sctp (1) [INIT] [init tag: 2840986903] [rwnd: 106496] [OS: 10] [MIS: 10] [init TSN: 2725566662]
14:31:37.004107 IP 20.20.20.1.38412 > ip-10-20-2-145.ec2.internal.56784: sctp (1) [ABORT]
```

What I have tried
- Verified LoxiLB is reachable on the VIP (20.20.20.1)
- GRE tunnel between TGW and LoxiLB is up and passing traffic
- No packet drops in the path
- LoxiLB BGP sessions are established properly

I am aware of https://docs.loxilb.io/debugging/#sctp-packets-dropping about the SCTP ABORT but I believe this is a valid use-case that should be looked into as well.

GoBGP config file:
```
global:
  config:
    as: 64513
    router-id: 169.254.100.1
neighbors:
  - config:
      neighbor-address: 169.254.100.2
      peer-as: 64512
    transport:
      config:
        passive-mode: true
        local-address: 169.254.100.1
        # Remove TTL setting as we're using a GRE tunnel
    ebgp-multihop:
      config:
        enabled: true
        multihop-ttl: 5
    timers:
      config:
        hold-time: 90
        keepalive-interval: 30
    afi-safis:
      - config:
          afi-safi-name: ipv4-unicast
          enabled: true
  - config:
      neighbor-address: 169.254.100.3
      peer-as: 64512
    transport:
      config:
        passive-mode: true
        local-address: 169.254.100.1
    ebgp-multihop:
      config:
        enabled: true
        multihop-ttl: 5
    timers:
      config:
        hold-time: 90
        keepalive-interval: 30
    afi-safis:
      - config:
          afi-safi-name: ipv4-unicast
          enabled: true
```

LoxiLB commands:

```
/root/loxilb-io/loxilb/loxilb -b &
loxicmd create lb 20.20.20.1 --bgp --sctp=38412:38412 --endpoints=10.10.2.17:1,10.10.2.18:1 --mode=onearm
```

Below is the loxilb logs

```
INFO: 2025/04/14 14:28:02 ebpf unload - lo
INFO: 2025/04/14 14:28:02 ebpf unload - gre0
INFO: 2025/04/14 14:28:02 ebpf unload - gretap0
INFO: 2025/04/14 14:28:02 ebpf unload - erspan0
INFO: 2025/04/14 14:28:02 ebpf unload - eth0
INFO: 2025/04/14 14:28:02 ebpf unload - gre1
INFO: 2025/04/14 14:28:02 ebpf unload - n2
NOTI: 2025/04/14 14:28:02 ******************* BGP Monitor start *******************
ERR:  2025/04/14 14:28:02 Error in stopping gpbgp:exit status 1
INFO: 2025/04/14 14:28:02 BGP session 127.0.0.1:50052 not ready. Will Retry!
INFO: 2025/04/14 14:28:04 BGP session 127.0.0.1:50052 not ready. Will Retry!
INFO: 2025/04/14 14:28:05 nlp: Link msgs subscribed
INFO: 2025/04/14 14:28:05 nlp: Addr msgs subscribed
INFO: 2025/04/14 14:28:05 nlp: Neigh msgs subscribed
INFO: 2025/04/14 14:28:05 nlp: Route msgs subscribed
INFO: 2025/04/14 14:28:05 nlp: NLP Subscription done
INFO: 2025/04/14 14:28:05 nlp: Getting device info
DBG:  2025/04/14 14:28:05 nlp: ADD dev gre0 mac([0 0 0 0 0 0]) attrs(&{2 1476 1000 gre0  0 128 0 0 <nil>  0xc004aacd80 0 0 0 0xc0032c42b8 gre <nil> down 0 -1 1 1 65536 65535 [] 0 <nil>}) - info recvd
DBG:  2025/04/14 14:28:05 port add - vlan3801 isPvid false
DBG:  2025/04/14 14:28:05 port added - vlan3801:2 OSID -1
INFO: 2025/04/14 14:28:05 vlan 3801 bd created
DBG:  2025/04/14 14:28:05 port added - gre0:1 OSID 2
INFO: 2025/04/14 14:28:05 nlp: Port gre0, [0 0 0 0 0 0], false, 1476 add [OK]
DBG:  2025/04/14 14:28:05 nlp: ADD dev gretap0 mac([0 0 0 0 0 0]) attrs(&{3 1462 1000 gretap0  broadcast|multicast 4098 0 0 <nil>  0xc004aacf00 0 0 1 0xc0032c42d0 ether <nil> down 0 -1 1 1 65536 65535 [] 0 <nil>}) - info recvd
DBG:  2025/04/14 14:28:05 port add - vlan3803 isPvid false
DBG:  2025/04/14 14:28:05 port added - vlan3803:4 OSID -1
INFO: 2025/04/14 14:28:05 vlan 3803 bd created
DBG:  2025/04/14 14:28:05 port added - gretap0:3 OSID 3
INFO: 2025/04/14 14:28:05 nlp: Port gretap0, [0 0 0 0 0 0], false, 1462 add [OK]
DBG:  2025/04/14 14:28:05 nlp: ADD dev erspan0 mac([0 0 0 0 0 0]) attrs(&{4 1450 1000 erspan0  broadcast|multicast 4098 0 0 <nil>  0xc004aad080 0 0 1 0xc0032c42e8 ether <nil> down 0 -1 1 1 65536 65535 [] 0 <nil>}) - info recvd
DBG:  2025/04/14 14:28:05 port add - vlan3805 isPvid false
DBG:  2025/04/14 14:28:05 port added - vlan3805:6 OSID -1
INFO: 2025/04/14 14:28:05 vlan 3805 bd created
DBG:  2025/04/14 14:28:05 port added - erspan0:5 OSID 4
INFO: 2025/04/14 14:28:05 nlp: Port erspan0, [0 0 0 0 0 0], false, 1450 add [OK]
DBG:  2025/04/14 14:28:05 nlp: ADD dev eth0 mac([134 27 67 162 96 163]) attrs(&{6 9001 0 eth0 86:1b:43:a2:60:a3 up|broadcast|multicast 69699 49 0 <nil>  0xc004aad200 0 0 1 0xc0032c4300 ether <nil> up 0 0 16 16 65536 65535 [] 0 <nil>}) - info recvd
DBG:  2025/04/14 14:28:05 port add - vlan3807 isPvid false
DBG:  2025/04/14 14:28:05 port added - vlan3807:8 OSID -1
INFO: 2025/04/14 14:28:05 vlan 3807 bd created
DBG:  2025/04/14 14:28:05 port added - eth0:7 OSID 6
INFO: 2025/04/14 14:28:05 nlp: Port eth0, [134 27 67 162 96 163], true, 9001 add [OK]
DBG:  2025/04/14 14:28:05 nlp: ADD dev gre1 mac([10 10 2 20 8 0]) attrs(&{7 8977 1000 gre1 0a:0a:02:14 up|pointtopoint 65745 0 0 <nil>  0xc004aad380 0 0 0 0xc0032c4318 gre <nil> unknown 0 -1 1 1 65536 65535 [] 0 <nil>}) - info recvd
DBG:  2025/04/14 14:28:05 port add - vlan3809 isPvid false
DBG:  2025/04/14 14:28:05 port added - vlan3809:10 OSID -1
INFO: 2025/04/14 14:28:05 vlan 3809 bd created
DBG:  2025/04/14 14:28:05 port added - gre1:9 OSID 7
INFO: 2025/04/14 14:28:05 nlp: Port gre1, [10 10 2 20 8 0], true, 8977 add [OK]
DBG:  2025/04/14 14:28:05 nlp: ADD dev llb0 mac([0 0 202 254 250 206]) attrs(&{8 1500 1000 llb0 00:00:ca:fe:fa:ce up|broadcast|multicast 69699 0 0 <nil>  0xc004aad500 0 0 1 0xc0032c4330 ether <nil> unknown 0 -1 1 1 65536 65535 [] 0 <nil>}) - info recvd
DBG:  2025/04/14 14:28:05 port add - vlan3811 isPvid false
DBG:  2025/04/14 14:28:05 port added - vlan3811:12 OSID -1
INFO: 2025/04/14 14:28:05 vlan 3811 bd created
DBG:  2025/04/14 14:28:05 port added - llb0:11 OSID 8
INFO: 2025/04/14 14:28:05 nlp: Port llb0, [0 0 202 254 250 206], true, 1500 add [OK]
DBG:  2025/04/14 14:28:05 nlp: ADD dev n2 mac([2 67 19 98 218 129]) attrs(&{18 9001 1000 n2 02:43:13:62:da:81 up|broadcast|multicast 69699 0 0 <nil> ens6 0xc004aad680 0 0 1 0xc0032c4348 ether <nil> up 0 -1 16 16 65536 65535 [] 0 <nil>}) - info recvd
DBG:  2025/04/14 14:28:05 port add - vlan3813 isPvid false
DBG:  2025/04/14 14:28:05 port added - vlan3813:14 OSID -1
INFO: 2025/04/14 14:28:05 vlan 3813 bd created
DBG:  2025/04/14 14:28:05 port added - n2:13 OSID 18
INFO: 2025/04/14 14:28:05 nlp: Port n2, [2 67 19 98 218 129], true, 9001 add [OK]
DBG:  2025/04/14 14:28:05 rt added - 127.0.0.0/8:root mark:
DBG:  2025/04/14 14:28:05 rt added - 127.0.0.1/32:root mark:
DBG:  2025/04/14 14:28:05 ifa added 127.0.0.1:lo
INFO: 2025/04/14 14:28:05 nlp: IPv4 Address 127.0.0.1/8 Port lo added
DBG:  2025/04/14 14:28:05 rt added - ::1/128:root mark:
DBG:  2025/04/14 14:28:05 ifa added ::1:lo
INFO: 2025/04/14 14:28:05 nlp: IPv4 Address ::1/128 Port lo added
DBG:  2025/04/14 14:28:05 nlp: No addresses found for intf gre0
DBG:  2025/04/14 14:28:05 nlp: No neighbors found for intf gre0
DBG:  2025/04/14 14:28:05 nlp: No addresses found for intf gretap0
DBG:  2025/04/14 14:28:05 nlp: No neighbors found for intf gretap0
DBG:  2025/04/14 14:28:05 nlp: No addresses found for intf erspan0
DBG:  2025/04/14 14:28:05 nlp: No neighbors found for intf erspan0
DBG:  2025/04/14 14:28:05 rt added - 10.10.1.124/32:root mark:
DBG:  2025/04/14 14:28:05 ifa added 10.10.1.124:eth0
INFO: 2025/04/14 14:28:05 nlp: IPv4 Address 10.10.1.124/32 Port eth0 added
DBG:  2025/04/14 14:28:05 rt added - fe80::/64:root mark:
DBG:  2025/04/14 14:28:05 rt added - fe80::/32:root mark:
DBG:  2025/04/14 14:28:05 ifa added fe80::841b:43ff:fea2:60a3:eth0
INFO: 2025/04/14 14:28:05 nlp: IPv4 Address fe80::841b:43ff:fea2:60a3/64 Port eth0 added
DBG:  2025/04/14 14:28:05 neigh rtpair - 10.10.1.254/32->10.10.1.254
DBG:  2025/04/14 14:28:05 rt added - 10.10.1.254/32:root mark:1
DBG:  2025/04/14 14:28:05 added fdb ent, {[242 206 149 74 118 236] 3807} : health(true)
DBG:  2025/04/14 14:28:05 neigh added - 10.10.1.254:root (1)
DBG:  2025/04/14 14:28:05 neigh rtpair - 169.254.1.1/32->169.254.1.1
DBG:  2025/04/14 14:28:05 rt added - 169.254.1.1/32:root mark:2
DBG:  2025/04/14 14:28:05 neigh added - 169.254.1.1:root (2)
DBG:  2025/04/14 14:28:05 neigh rtpair - ff02::16/128->ff02::16
DBG:  2025/04/14 14:28:05 rt added - ff02::16/128:root mark:3
DBG:  2025/04/14 14:28:05 added fdb ent, {[51 51 0 0 0 22] 3807} : health(true)
DBG:  2025/04/14 14:28:05 neigh added - ff02::16:root (3)
DBG:  2025/04/14 14:28:05 neigh rtpair - ff02::1:ffa2:60a3/128->ff02::1:ffa2:60a3
DBG:  2025/04/14 14:28:05 rt added - ff02::1:ffa2:60a3/128:root mark:4
DBG:  2025/04/14 14:28:05 added fdb ent, {[51 51 255 162 96 163] 3807} : health(true)
DBG:  2025/04/14 14:28:05 neigh added - ff02::1:ffa2:60a3:root (4)
DBG:  2025/04/14 14:28:05 neigh rtpair - ff02::2/128->ff02::2
DBG:  2025/04/14 14:28:05 rt added - ff02::2/128:root mark:5
DBG:  2025/04/14 14:28:05 added fdb ent, {[51 51 0 0 0 2] 3807} : health(true)
DBG:  2025/04/14 14:28:05 neigh added - ff02::2:root (5)
DBG:  2025/04/14 14:28:05 rt added - 169.254.100.0/29:root mark:
DBG:  2025/04/14 14:28:05 rt added - 169.254.100.1/32:root mark:
DBG:  2025/04/14 14:28:05 ifa added 169.254.100.1:gre1
INFO: 2025/04/14 14:28:05 nlp: IPv4 Address 169.254.100.1/29 Port gre1 added
DBG:  2025/04/14 14:28:05 rt added - 20.20.20.1/32:root mark:
DBG:  2025/04/14 14:28:05 ifa added 20.20.20.1:gre1
INFO: 2025/04/14 14:28:05 nlp: IPv4 Address 20.20.20.1/32 Port gre1 added
DBG:  2025/04/14 14:28:05  - fe80::a0a:214:gre1 subnet-rt error
ERR:  2025/04/14 14:28:05 nlp: IPv4 Address fe80::a0a:214/64 Port gre1 failed subnet-route add error
ERR:  2025/04/14 14:28:05 nlp: IPv4 Address fe80::70e8:27ff:fe33:e69f/64 Port llb0 failed subnet-route add error
DBG:  2025/04/14 14:28:05 added fdb ent, {[51 51 0 0 0 2] 3811} : health(true)
DBG:  2025/04/14 14:28:05 neigh added - ff02::2:root (6)
DBG:  2025/04/14 14:28:05 neigh rtpair - ff02::1:ff33:e69f/128->ff02::1:ff33:e69f
DBG:  2025/04/14 14:28:05 rt added - ff02::1:ff33:e69f/128:root mark:7
DBG:  2025/04/14 14:28:05 added fdb ent, {[51 51 255 51 230 159] 3811} : health(true)
DBG:  2025/04/14 14:28:05 neigh added - ff02::1:ff33:e69f:root (7)
DBG:  2025/04/14 14:28:05 added fdb ent, {[51 51 0 0 0 22] 3811} : health(true)
DBG:  2025/04/14 14:28:05 neigh added - ff02::16:root (8)
DBG:  2025/04/14 14:28:05 rt added - 10.10.2.0/24:root mark:
DBG:  2025/04/14 14:28:05 rt added - 10.10.2.20/32:root mark:
DBG:  2025/04/14 14:28:05 ifa added 10.10.2.20:n2
INFO: 2025/04/14 14:28:05 nlp: IPv4 Address 10.10.2.20/24 Port n2 added
DBG:  2025/04/14 14:28:05  - fe80::43:13ff:fe62:da81:n2 subnet-rt error
ERR:  2025/04/14 14:28:05 nlp: IPv4 Address fe80::43:13ff:fe62:da81/64 Port n2 failed subnet-route add error
DBG:  2025/04/14 14:28:05 neigh rtpair - 10.10.2.1/32->10.10.2.1
DBG:  2025/04/14 14:28:05 rt added - 10.10.2.1/32:root mark:9
DBG:  2025/04/14 14:28:05 added fdb ent, {[2 65 55 7 53 205] 3813} : health(true)
DBG:  2025/04/14 14:28:05 neigh added - 10.10.2.1:root (9)
DBG:  2025/04/14 14:28:05 neigh rtpair - ff02::1:ff62:da81/128->ff02::1:ff62:da81
DBG:  2025/04/14 14:28:05 rt added - ff02::1:ff62:da81/128:root mark:10
DBG:  2025/04/14 14:28:05 added fdb ent, {[51 51 255 98 218 129] 3813} : health(true)
DBG:  2025/04/14 14:28:05 neigh added - ff02::1:ff62:da81:root (10)
DBG:  2025/04/14 14:28:05 added fdb ent, {[51 51 0 0 0 22] 3813} : health(true)
DBG:  2025/04/14 14:28:05 neigh added - ff02::16:root (11)
DBG:  2025/04/14 14:28:05 added fdb ent, {[51 51 0 0 0 2] 3813} : health(true)
DBG:  2025/04/14 14:28:05 neigh added - ff02::2:root (12)
DBG:  2025/04/14 14:28:05 neigh rtpair - 0.0.0.0/0->169.254.1.1
DBG:  2025/04/14 14:28:05 rt added - 0.0.0.0/0:root mark:2
INFO: 2025/04/14 14:28:05 nlp: RT  0.0.0.0/0 via 169.254.1.1 added
ERR:  2025/04/14 14:28:05 nlp: RT  10.10.2.0/24 add failed-rt exists
INFO: 2025/04/14 14:28:05 rt add - 169.254.1.1/32:root updated to (if-route)
INFO: 2025/04/14 14:28:05 nlp: RT  169.254.1.1/32 added
ERR:  2025/04/14 14:28:05 nlp: RT  169.254.100.0/29 add failed-rt exists
DBG:  2025/04/14 14:28:05 neigh rtpair - 192.168.100.0/24->10.10.2.1
DBG:  2025/04/14 14:28:05 rt added - 192.168.100.0/24:root mark:9
INFO: 2025/04/14 14:28:05 nlp: RT  192.168.100.0/24 via 10.10.2.1 added
ERR:  2025/04/14 14:28:05 nlp: RT  fe80::/64 add failed-rt exists
ERR:  2025/04/14 14:28:05 nlp: RT  fe80::/64 add failed-rt exists
ERR:  2025/04/14 14:28:05 nlp: RT  fe80::/64 add failed-rt exists
ERR:  2025/04/14 14:28:05 nlp: RT  fe80::/64 add failed-rt exists
INFO: 2025/04/14 14:28:05 nlp: nlp get done
INFO: 2025/04/14 14:28:05 nlp: Continuing without EP config file: stat /etc/loxilb//EPconfig.txt: no such file or directory
INFO: 2025/04/14 14:28:05 nlp: EndPoint config process done
INFO: 2025/04/14 14:28:05 nlp: Continuing without LB config file : stat /etc/loxilb//lbconfig.txt: no such file or directory
INFO: 2025/04/14 14:28:05 nlp: LoadBalancer config done
INFO: 2025/04/14 14:28:05 nlp: Continuing without Session config file : stat /etc/loxilb//sessionconfig.txt: no such file or directory
INFO: 2025/04/14 14:28:05 nlp: Session config done
INFO: 2025/04/14 14:28:05 nlp: Continuing without UlCl config file : stat /etc/loxilb//sessionulclconfig.txt: no such file or directory
INFO: 2025/04/14 14:28:05 nlp: Session UlCl config done
INFO: 2025/04/14 14:28:05 nlp: Continuing without Firewall config file : stat /etc/loxilb//FWconfig.txt: no such file or directory
INFO: 2025/04/14 14:28:05 nlp: Firewall config done
INFO: 2025/04/14 14:28:06 BGP session 127.0.0.1:50052 not ready. Will Retry!
DBG:  2025/04/14 14:28:06 ebpf intfmap added - 2 vlan 0 -> 1
DBG:  2025/04/14 14:28:06 ebpf txintfmap added - 1 -> 2
DBG:  2025/04/14 14:28:07 Get xsync()
DBG:  2025/04/14 14:28:07 ebpf intfmap added - 3 vlan 0 -> 3
DBG:  2025/04/14 14:28:07 ebpf txintfmap added - 3 -> 3
DBG:  2025/04/14 14:28:08 ebpf intfmap added - 4 vlan 0 -> 5
DBG:  2025/04/14 14:28:08 ebpf txintfmap added - 5 -> 4
INFO: 2025/04/14 14:28:08 BGP session 127.0.0.1:50052 not ready. Will Retry!
DBG:  2025/04/14 14:28:08 ebpf intfmap added - 6 vlan 0 -> 7
DBG:  2025/04/14 14:28:08 ebpf txintfmap added - 7 -> 6
DBG:  2025/04/14 14:28:09 ebpf intfmap added - 7 vlan 0 -> 9
DBG:  2025/04/14 14:28:09 ebpf txintfmap added - 9 -> 7
DBG:  2025/04/14 14:28:09 ebpf intfmap added - 8 vlan 0 -> 511
DBG:  2025/04/14 14:28:09 ebpf txintfmap added - 511 -> 8
DBG:  2025/04/14 14:28:10 ebpf intfmap added - 18 vlan 0 -> 13
DBG:  2025/04/14 14:28:10 ebpf txintfmap added - 13 -> 18
INFO: 2025/04/14 14:28:10 BGP session 127.0.0.1:50052 not ready. Will Retry!
NOTI: 2025/04/14 14:28:12 BGP server 127.0.0.1:50052 UP!
NOTI: 2025/04/14 14:28:12 BGP session 127.0.0.1:50052 ready! Attributes[global:{asn:64513 router_id:"169.254.100.1" listen_port:179 listen_addresses:"0.0.0.0" listen_addresses:"::"}]
NOTI: 2025/04/14 14:28:13 ******************* BGP 127.0.0.1:50052 connected *******************
DBG:  2025/04/14 14:28:29 api: lbRules : {{20.20.20.1  38412 0 sctp 0 0 true false 0 0 1 0 false  0   0 0  0 false  false false} [] [] [{10.10.2.18 38412 1  } {10.10.2.17 38412 1  }]}
DBG:  2025/04/14 14:28:29 ep-host added 10.10.2.17_sctp_38412:0
DBG:  2025/04/14 14:28:29 ep-host added 10.10.2.18_sctp_38412:1
DBG:  2025/04/14 14:28:29 onearm:suitable source for 10.10.2.17: 10.10.2.20
DBG:  2025/04/14 14:28:29 onearm:suitable source for 10.10.2.18: 10.10.2.20
DBG:  2025/04/14 14:28:29 lb-rule added - 1:dst-20.20.20.1/32,proto-132,dport-38412,-do-fullnat:onearm:eip-10.10.2.17,ep-38412,w-1,alive|eip-10.10.2.18,ep-38412,w-1,alive|
DBG:  2025/04/14 14:28:29 [GoBGP] Advertised Route [OK]: 20.20.20.1/32 via 0.0.0.0 pref(0):med(0)
DBG:  2025/04/14 14:28:30 [DP] LB rule 20.20.20.1:0 add[OK]
DBG:  2025/04/14 14:28:30 inactive ep - 10.10.2.17_sctp_38412:sctp:38412(next try after 60s)
DBG:  2025/04/14 14:28:30 neigh rtpair - 10.10.2.18/32->10.10.2.18
DBG:  2025/04/14 14:28:30 rt added - 10.10.2.18/32:root mark:13
DBG:  2025/04/14 14:28:30 added fdb ent, {[2 53 216 166 74 51] 3813} : health(true)
DBG:  2025/04/14 14:28:30 neigh added - 10.10.2.18:root (13)
DBG:  2025/04/14 14:28:32 active ep - 10.10.2.17_sctp_38412:sctp:38412(0s)
DBG:  2025/04/14 14:28:32 neigh rtpair - 10.10.2.17/32->10.10.2.17
DBG:  2025/04/14 14:28:32 rt added - 10.10.2.17/32:root mark:14
DBG:  2025/04/14 14:28:32 added fdb ent, {[2 253 148 76 120 19] 3813} : health(true)
DBG:  2025/04/14 14:28:32 neigh added - 10.10.2.17:root (14)
DBG:  2025/04/14 14:29:02 neigh rtpair - 169.254.100.2/32->169.254.100.2
DBG:  2025/04/14 14:29:02 rt added - 169.254.100.2/32:root mark:15
DBG:  2025/04/14 14:29:02 neigh added - 169.254.100.2:root (15)
DBG:  2025/04/14 14:29:02 neigh rtpair - 10.10.0.0/16->169.254.100.2
DBG:  2025/04/14 14:29:02 rt added - 10.10.0.0/16:root mark:15
INFO: 2025/04/14 14:29:02 nlp: RT  10.10.0.0/16 via 169.254.100.2 added
DBG:  2025/04/14 14:29:02 neigh rtpair - 10.20.0.0/16->169.254.100.2
DBG:  2025/04/14 14:29:02 rt added - 10.20.0.0/16:root mark:15
INFO: 2025/04/14 14:29:02 nlp: RT  10.20.0.0/16 via 169.254.100.2 added
DBG:  2025/04/14 14:30:38 inactive ep - 10.10.2.18_sctp_38412:sctp:38412(next try after 60s)
DBG:  2025/04/14 14:30:40 active ep - 10.10.2.18_sctp_38412:sctp:38412(0s)
DBG:  2025/04/14 14:34:54 inactive ep - 10.10.2.17_sctp_38412:sctp:38412(next try after 60s)
DBG:  2025/04/14 14:34:56 active ep - 10.10.2.17_sctp_38412:sctp:38412(0s)
DBG:  2025/04/14 14:37:02 inactive ep - 10.10.2.17_sctp_38412:sctp:38412(next try after 60s)
DBG:  2025/04/14 14:37:04 active ep - 10.10.2.17_sctp_38412:sctp:38412(0s)
DBG:  2025/04/14 14:40:14 inactive ep - 10.10.2.17_sctp_38412:sctp:38412(next try after 60s)
DBG:  2025/04/14 14:40:16 active ep - 10.10.2.17_sctp_38412:sctp:38412(0s)
DBG:  2025/04/14 14:42:22 inactive ep - 10.10.2.18_sctp_38412:sctp:38412(next try after 60s)
DBG:  2025/04/14 14:42:24 active ep - 10.10.2.18_sctp_38412:sctp:38412(0s)
DBG:  2025/04/14 14:44:30 inactive ep - 10.10.2.18_sctp_38412:sctp:38412(next try after 60s)
DBG:  2025/04/14 14:44:32 active ep - 10.10.2.18_sctp_38412:sctp:38412(0s)
DBG:  2025/04/14 14:47:42 inactive ep - 10.10.2.18_sctp_38412:sctp:38412(next try after 60s)
DBG:  2025/04/14 14:47:44 active ep - 10.10.2.18_sctp_38412:sctp:38412(0s)
```
