### ISSUE TITLE
Making QFI in GTP Extension Header optional

### ISSUE THREAD

**Issue by nik-netlox** [loxilb-io/loxilb#109]
@nik-netlox - I just tested the ulcl scenario but the GTP packet is still going directly to the UPF, below is the commands I used:

```
./loxicmd create session user1 10.45.0.2 --accessNetworkTunnel=1:192.168.1.125 --coreNetworkTunnel=1:192.168.70.2

./loxicmd create sessionulcl user1 --ulclArgs=1:88.88.88.88

./loxicmd create lb 88.88.88.88 --tcp=2020:80 --endpoints=172.17.0.2:1
```

10.45.0.2 - This is UE IP address that was allocated by the SMF

192.168.1.125 - This is the gNB (am assuming that the **_1:_** signifies the TEID?)

192.168.70.2 - This is the UPF address (am also assuming that the **_1:_** signifies the TEID?)

172.17.0.2 - This is the IP of nginx docker container, it is running on the same VM with loxilb.

when I initiate a curl to 88.88.88.88:2020, the whole GTP packet is been routed directly to the UPF.

```
root@core5g-upf-deployment-549f9c55c7-vsfkm:/# tcpdump -i any host 10.45.0.2 -s0 -nv
tcpdump: data link type LINUX_SLL2
tcpdump: listening on any, link-type LINUX_SLL2 (Linux cooked v2), snapshot length 262144 bytes
18:47:28.807635 ogstun In  IP (tos 0x0, ttl 64, id 4042, offset 0, flags [DF], proto TCP (6), length 60)
    10.45.0.2.36822 > 88.88.88.88.2020: Flags [S], cksum 0x0123 (correct), seq 1684491581, win 65280, options [mss 1360,sackOK,TS val 554640115 ecr 0,nop,wscale 7], length 0
18:48:02.855673 ogstun In  IP (tos 0x0, ttl 64, id 4043, offset 0, flags [DF], proto TCP (6), length 60)
    10.45.0.2.36822 > 88.88.88.88.2020: Flags [S], cksum 0x7c22 (correct), seq 1684491581, win 65280, options [mss 1360,sackOK,TS val 554674163 ecr 0,nop,wscale 7], length 0
18:49:00.268594 ogstun In  IP (tos 0x0, ttl 64, id 37730, offset 0, flags [DF], proto TCP (6), length 60)
    10.45.0.2.41540 > 88.88.88.88.80: Flags [S], cksum 0x6ab8 (correct), seq 2188858742, win 65280, options [mss 1360,sackOK,TS val 554731577 ecr 0,nop,wscale 7], length 0
18:49:01.286827 ogstun In  IP (tos 0x0, ttl 64, id 37731, offset 0, flags [DF], proto TCP (6), length 60)
    10.45.0.2.41540 > 88.88.88.88.80: Flags [S], cksum 0x66be (correct), seq 2188858742, win 65280, options [mss 1360,sackOK,TS val 554732595 ecr 0,nop,wscale 7], length 0
18:49:03.303906 ogstun In  IP (tos 0x0, ttl 64, id 37732, offset 0, flags [DF], proto TCP (6), length 60)
    10.45.0.2.41540 > 88.88.88.88.80: Flags [S], cksum 0x5ede (correct), seq 2188858742, win 65280, options [mss 1360,sackOK,TS val 554734611 ecr 0,nop,wscale 7], length 0
18:49:07.367011 ogstun In  IP (tos 0x0, ttl 64, id 37733, offset 0, flags [DF], proto TCP (6), length 60)
    10.45.0.2.41540 > 88.88.88.88.80: Flags [S], cksum 0x4efe (correct), seq 2188858742, win 65280, options [mss 1360,sackOK,TS val 554738675 ecr 0,nop,wscale 7], length 0
18:49:15.559083 ogstun In  IP (tos 0x0, ttl 64, id 37734, offset 0, flags [DF], proto TCP (6), length 60)
    10.45.0.2.41540 > 88.88.88.88.80: Flags [S], cksum 0x2efe (correct), seq 2188858742, win 65280, options [mss 1360,sackOK,TS val 554746867 ecr 0,nop,wscale 7], length 0
18:49:31.686701 ogstun In  IP (tos 0x0, ttl 64, id 37735, offset 0, flags [DF], proto TCP (6), length 60)
    10.45.0.2.41540 > 88.88.88.88.80: Flags [S], cksum 0xeffe (correct), seq 2188858742, win 65280, options [mss 1360,sackOK,TS val 554762994 ecr 0,nop,wscale 7], length 0
18:50:05.736861 ogstun In  IP (tos 0x0, ttl 64, id 37736, offset 0, flags [DF], proto TCP (6), length 60)
    10.45.0.2.41540 > 88.88.88.88.80: Flags [S], cksum 0x6afd (correct), seq 2188858742, win 65280, options [mss 1360,sackOK,TS val 554797043 ecr 0,nop,wscale 7], length 0
18:53:36.381953 ogstun In  IP (tos 0x0, ttl 64, id 29799, offset 0, flags [DF], proto TCP (6), length 60)
    10.45.0.2.34228 > 172.217.1.206.80: Flags [S], cksum 0x1fa7 (correct), seq 4006597962, win 65280, options [mss 1360,sackOK,TS val 471468717 ecr 0,nop,wscale 7], length 0
18:53:36.403332 ogstun Out IP (tos 0x0, ttl 56, id 0, offset 0, flags [DF], proto TCP (6), length 60)
```

Also note that I am using loxilb as the gateway for the gNB so all the traffic is passing through loxilb.

Interface config of loxilb VM:

```
lo               UNKNOWN        127.0.0.1/8 ::1/128
enp0s3           UP             192.168.1.124/24 2600:4040:2929:ef00:a00:27ff:fee7:8cfe/64 fe80::a00:27ff:fee7:8cfe/64
enp0s8           UP             192.168.56.101/24 fe80::a00:27ff:fec9:9199/64
enp0s9           UP             192.168.70.1/24 fe80::a00:27ff:fe85:d9bb/64
llb0             UP             fe80::806:9bff:fed2:ff1f/64
docker0          UP             172.17.0.1/16 fe80::42:dcff:fe15:2bad/64
vethfb5e074@if7  UP             fe80::447c:b7ff:fea9:e9fe/64
```
Attached is the console logs when I start loxilb, maybe that can throw more light.

[loxilb-ulcl-oct-06.txt](https://github.com/loxilb-io/loxilb/files/9728264/loxilb-ulcl-oct-06.txt)

Another question, how can I redirect the logs of loxilb to a log file instead of stdout? I am not using docker.

_Originally posted by @infinitydon in https://github.com/loxilb-io/loxilb/discussions/97#discussioncomment-3817625_
