### ISSUE TITLE
run loxilb in standalone mode curl: connection refused

### ISSUE THREAD

**Issue by yolooks** [loxilb-io/loxilb#992]
**Describe the bug**
root@c75a03aba241:/# loxicmd get lb -o wide
|   EXT IP    | SEC IPS | SOURCES | HOST | PORT | PROTO | NAME | MARK | SEL |  MODE   |  ENDPOINT  | EPORT | WEIGHT | STATE | COUNTERS |
|-------------|---------|---------|------|------|-------|------|------|-----|---------|------------|-------|--------|-------|----------|
| 10.9.16.249 |         |         |      |   80 | tcp   |      |    0 | rr  | fullnat | 10.9.16.20 |    80 |    100 | -     | 0:0      |
root@c75a03aba241:/#
root@c75a03aba241:/# loxicmd get ep -o wide
|    HOST    |       NAME        | PTYPE | PORT | DURATION | RETRIES | MINDELAY | AVGDELAY | MAXDELAY | STATE |
|------------|-------------------|-------|------|----------|---------|----------|----------|----------|-------|
| 10.9.16.20 | 10.9.16.20_tcp_80 | tcp:  |   80 |       60 |       2 |          |          |          | ok    |
root@c75a03aba241:/#
root@c75a03aba241:/# ping -c 1 10.9.16.249
PING 10.9.16.249 (10.9.16.249) 56(84) bytes of data.
64 bytes from 10.9.16.249: icmp_seq=1 ttl=64 time=0.042 ms

--- 10.9.16.249 ping statistics ---
1 packets transmitted, 1 received, 0% packet loss, time 0ms
rtt min/avg/max/mdev = 0.042/0.042/0.042/0.000 ms
root@c75a03aba241:/#
root@c75a03aba241:/# curl -I http://10.9.16.20
HTTP/1.1 200 OK
Server: nginx/1.26.1
Date: Sun, 30 Mar 2025 02:56:42 GMT
Content-Type: text/html
Content-Length: 615
Last-Modified: Wed, 29 May 2024 19:07:19 GMT
Connection: keep-alive
ETag: "66577ce7-267"
Accept-Ranges: bytes

root@c75a03aba241:/#
root@c75a03aba241:/# curl -I http://10.9.16.249
curl: (7) Failed to connect to 10.9.16.249 port 80: Connection refused
root@c75a03aba241:/#

**To Reproduce**
# docker network create -d macvlan -o parent=eth0 --subnet=10.9.16.0/24 --gateway=10.9.16.254 llbnet

# docker run -u root --cap-add SYS_ADMIN --pid=host --cgroupns=host --network host --privileged -dit -v /dev/log:/dev/log --name loxilb ghcr.io/loxilb-io/loxilb:latest

# docker ps -a
CONTAINER ID   IMAGE                             COMMAND                  CREATED         STATUS         PORTS     NAMES
c75a03aba241   ghcr.io/loxilb-io/loxilb:latest   "/root/loxilb-io/lox…"   3 minutes ago   Up 3 minutes             loxilb

[root@jja-ops-lb00 lhsa]# docker logs loxilb
loxilb start
libbpf: Kernel error message: Cannot find specified qdisc on specified device
02:45:36 ERROR common_libbpf.c:94: tc: bpf hook destroy failed for llb0:0
02:45:36 DEBUG loxilb_libdp.c:3506: /opt/loxilb/llb_xdp_main.o: nr 0 psection xdp_packet_hook
libbpf: Error in bpf_create_map_xattr(nh_map):Invalid argument(-22). Retrying without BTF.
libbpf: Error in bpf_create_map_xattr(xctk):unknown error (-524)(-524). Retrying without BTF.
02:45:37 DEBUG loxilb_libdp.c:3272: llb_link_prop_add: IF-llb0 added idx 0 type 1
02:45:37 DEBUG loxilb_libdp.c:3525: setting up xdp for llb0|xdp_packet_hook
libbpf: failed to statfs /opt/loxilb/dp/bpf: No such file or directory
02:45:37 WARN  loxilb_libdp.c:1227: /opt/loxilb/dp/bpf: Unpin maps failed
02:45:37 DEBUG loxilb_libdp.c:3347: llb_psec_add: SEC-tc_packet_hook0 added idx 0
02:45:37 DEBUG loxilb_libdp.c:3506: /opt/loxilb/llb_ebpf_main.o: nr 0 psection tc_packet_hook0
02:45:37 INFO  common_libbpf.c:121: tc: bpf attach start for llb0:0
02:45:37 ERROR common_libbpf.c:141: tc: no obj for pinpath /opt/loxilb/dp/bpf/llb_ebpf.rodata
02:45:37 DEBUG common_libbpf.c:161: tc: autoload sec tc_packet_hook1 prog tc_packet_func
02:45:37 DEBUG common_libbpf.c:161: tc: autoload sec tc_packet_hook2 prog tc_packet_func_slow
02:45:37 DEBUG common_libbpf.c:161: tc: autoload sec tc_packet_hook3 prog tc_packet_func_fw
02:45:37 DEBUG common_libbpf.c:161: tc: autoload sec tc_packet_hook4 prog tc_csum_func1
02:45:37 DEBUG common_libbpf.c:161: tc: autoload sec tc_packet_hook5 prog tc_csum_func2
02:45:37 DEBUG common_libbpf.c:161: tc: autoload sec tc_packet_hook6 prog tc_slow_unp_func
02:45:37 DEBUG common_libbpf.c:161: tc: autoload sec tc_packet_hook7 prog tc_packet_func_masq
02:45:37 INFO  common_libbpf.c:204: tc: bpf attach OK for llb0
02:45:37 DEBUG loxilb_libdp.c:3248: llb_link_prop_add: IF-llb0 ref idx 0:1 type 2
2025-03-30 02:45:37 ebpf unload - lo
libbpf: Kernel error message: Cannot find specified qdisc on specified device
02:45:37 ERROR common_libbpf.c:94: tc: bpf hook destroy failed for lo:0
2025-03-30 02:45:37 ebpf unload - eth0
libbpf: Kernel error message: Cannot find specified qdisc on specified device
02:45:37 ERROR common_libbpf.c:94: tc: bpf hook destroy failed for eth0:0
2025/03/30 02:45:37 Serving loxilb rest API at http://[::]:11111
...
02:45:41 DEBUG loxilb_libdp.c:3506: /opt/loxilb/llb_ebpf_main.o: nr 1 psection tc_packet_hook0
02:45:41 INFO  common_libbpf.c:121: tc: bpf attach start for eth0:0
02:45:41 ERROR common_libbpf.c:141: tc: no obj for pinpath /opt/loxilb/dp/bpf/llb_ebpf.rodata
02:45:41 DEBUG common_libbpf.c:161: tc: autoload sec tc_packet_hook1 prog tc_packet_func
...

# docker exec -it loxilb bash
root@c75a03aba241:/#
root@c75a03aba241:/# loxicmd create lb 10.9.16.249 --tcp=80:80 --endpoints=10.9.16.20:100 --mode=fullnat

**Expected behavior**

**Screenshots**

**Environment (please complete the following information):**
# cat /etc/centos-release
Rocky Linux release 8.10 (Green Obsidian)

# uname -r
5.15.63-1.el8.x86_64

# docker pull ghcr.io/loxilb-io/loxilb:latest

**Additional context**
Add any other context or topology about the problem here.

**Comment by inhogog2** [comment]
Hi @yolooks,

`root@c75a03aba241:/# curl -I http://10.9.16.249
curl: (7) Failed to connect to 10.9.16.249 port 80: Connection refused`

Looking at this command, it seems like you were testing inside LoxiLB docker container.

I recommend performing the test from an external node that has access to 10.9.16.249.

Could you let me know if the result is the same when testing from an external node that has access to 10.9.16.249?

**Comment by yolooks** [comment]
@inhogog2 

## The test results on the local machine are as follows:

```sh
# docker ps -a
CONTAINER ID   IMAGE                             COMMAND                  CREATED      STATUS      PORTS     NAMES
c75a03aba241   ghcr.io/loxilb-io/loxilb:latest   "/root/loxilb-io/lox…"   3 days ago   Up 3 days             loxilb
# ip a show lo
1: lo: <LOOPBACK,UP,LOWER_UP> mtu 65536 qdisc noqueue state UNKNOWN group default qlen 1000
    link/loopback 00:00:00:00:00:00 brd 00:00:00:00:00:00
    inet 127.0.0.1/8 scope host lo
       valid_lft forever preferred_lft forever
    inet 10.9.16.249/32 scope global lo
       valid_lft forever preferred_lft forever
    inet6 ::1/128 scope host
       valid_lft forever preferred_lft forever
# curl http://10.9.16.249
curl: (7) Failed to connect to 10.9.16.249 port 80: Connection refused
```

## The test results on other machines are as follows:

```sh
$ ping -c 1 10.9.16.45
PING 10.9.16.45 (10.9.16.45) 56(84) bytes of data.
64 bytes from 10.9.16.45: icmp_seq=1 ttl=64 time=0.015 ms

--- 10.9.16.45 ping statistics ---
1 packets transmitted, 1 received, 0% packet loss, time 0ms
rtt min/avg/max/mdev = 0.015/0.015/0.015/0.000 ms
$ curl http://10.9.16.249
curl: (7) Failed connect to 10.9.16.249:80; Connection refused
```

**Comment by TrekkieCoder** [comment]
Hi @yolooks 

Firstly, I can see that you are trying to create a macvlan. This will probably create an issue when you run loxilb with "--net=host" option. Hence I suggest you to use the steps of the following [example](https://docs.loxilb.io/latest/standalone/) -

```
# Create a mac-vlan (on an underlying interface e.g. enp0s3).
# Subnet used for mac-vlan is usually the same as underlying interface
docker network create -d macvlan -o parent=enp0s3   --subnet 172.30.1.0/24   --gateway 172.30.1.254 --aux-address 'host=172.30.1.193’ llbnet

# Run loxilb docker with the created macvlan 
docker run -u root --cap-add SYS_ADMIN   --restart unless-stopped --privileged -dit -v /dev/log:/dev/log --net=llbnet --ip=172.30.1.195 --name loxilb ghcr.io/loxilb-io/loxilb:latest

# If we still want to connect loxilb docker additionally to docker's default "bridge" network or more macvlan networks
docker network connect bridge loxilb
docker network connect llbnet2 loxilb --ip=172.30.2.195
```
If you are still not able to get it working, can you please provide the following - 

1. tcpdump logs in loxilb node while you run curl from outside host to 
2. Also. run ```loxicmd get ct``` while you run curl

**Comment by inhogog2** [comment]
Hi @yolooks 

I checked this issue. I tested on the rocky os. Here is my setup

```
[root@localhost ~]# cat /etc/centos-release
Rocky Linux release 8.10 (Green Obsidian)
[root@localhost ~]# uname -r
6.13.9-1.el8.elrepo.x86_64
```
First, I tried both macvlan and host mode, and there were no issues.

When configuring with macvlan and the provider is Oracle VirtualBox, please make sure to set PROMISC not only in the operating system terminal, but also in the virtual machine's network settings.

When using net=host, no separate configuration is required. Just check that the HA status is set to master and proceed with the setup.

I can't know exactly what kind of environment you're working in, but it seems like testing with net=host would be more convenient.

**Comment by TrekkieCoder** [comment]
To set HA state to master statically, you can use -

```
$ loxicmd get ha

     | INSTANCE  |   HASTATE   |
     |-----------|-------------|
     | llb-inst0 | NOT_DEFINED |

$  curl -X POST 'http://<loxi-nodeIP>:11111/netlox/v1/config/cistate' \
   -H 'accept: application/json' \
   -H 'Content-Type: application/json' \
   -d '{
     "instance": "llb-inst0",
     "state": "MASTER"
   }'
```

It is needed so that the load balancer VIP is applied to the master node. If you use kube-loxilb, it will be taken care of automatically.

**Comment by yolooks** [comment]
@inhogog2 @TrekkieCoder 

Thank you for your help. It's working now. However, I have another question. In DSR or FullNAT mode, curl works fine, but in NAT mode, curl times out.

## loxilb config(host ip: 10.9.16.52, vip: 10.9.16.249)

```sh
# docker exec -it loxilb loxicmd get lb -o wide
|   EXT IP    | SEC IPS | SOURCES | HOST | PORT  | PROTO | NAME | MARK | SEL  |  MODE   |  ENDPOINT  | EPORT | WEIGHT | STATE | COUNTERS  |
|-------------|---------|---------|------|-------|-------|------|------|------|---------|------------|-------|--------|-------|-----------|
| 10.9.16.249 |         |         |      |    80 | tcp   |      |    0 | hash | dsr     | 10.9.16.20 |    80 |    100 | -     | 44:3370   |
| 10.9.16.249 |         |         |      | 10010 | tcp   |      |    0 | rr   | default | 10.9.16.20 |    80 |    100 | -     | 42:3108   |
| 10.9.16.249 |         |         |      | 10080 | tcp   |      |    0 | rr   | fullnat | 10.9.16.20 |    80 |    100 | -     | 150:20298 |
```

## client test

```sh
# curl -I http://10.9.16.249:10010
curl: (7) Failed connect to 10.9.16.249:10010; Connection timed out
```

## troubleshooting

```sh
# docker exec -it loxilb loxicmd get ct
| SERVICE NAME |   DESTIP    |   SRCIP    | DPORT | SPORT | PROTO | IDENT |   STATE   |            ACT            | PACKETS | BYTES |
|--------------|-------------|------------|-------|-------|-------|-------|-----------|---------------------------|---------|-------|
|              | 10.9.16.249 | 10.9.16.45 | 10010 | 49492 | tcp   | 0:0   | sync-sent | dnat-10.9.16.20:80:w0     |       2 |   120 |
|              | 10.9.16.45  | 10.9.16.20 | 49492 |    80 | tcp   | 0:0   | sync-sent | sdsr-10.9.16.249:10010:w0 |       0 |     0 |

# tcpdump -i eth0 port 10010 -vv
dropped privs to tcpdump
tcpdump: listening on eth0, link-type EN10MB (Ethernet), capture size 262144 bytes

23:47:08.941190 IP (tos 0x0, ttl 64, id 32635, offset 0, flags [DF], proto TCP (6), length 60)
    jja-demo14.49494 > jja-ops-lb00.rxapi: Flags [S], cksum 0x3566 (incorrect -> 0x5f82), seq 2535245904, win 29200, options [mss 1460,sackOK,TS val 1110095659 ecr 0,nop,wscale 9], length 0
23:47:09.942014 IP (tos 0x0, ttl 64, id 32636, offset 0, flags [DF], proto TCP (6), length 60)
    jja-demo14.49494 > jja-ops-lb00.rxapi: Flags [S], cksum 0x3566 (incorrect -> 0x5b99), seq 2535245904, win 29200, options [mss 1460,sackOK,TS val 1110096660 ecr 0,nop,wscale 9], length 0
23:47:11.945865 IP (tos 0x0, ttl 64, id 32637, offset 0, flags [DF], proto TCP (6), length 60)
    jja-demo14.49494 > jja-ops-lb00.rxapi: Flags [S], cksum 0x3566 (incorrect -> 0x53c5), seq 2535245904, win 29200, options [mss 1460,sackOK,TS val 1110098664 ecr 0,nop,wscale 9], length 0

```

## realserver route

```sh
# ip a show eth0
2: eth0: <BROADCAST,MULTICAST,UP,LOWER_UP> mtu 1500 qdisc mq state UP group default qlen 1000
    link/ether fa:16:3e:98:27:4e brd ff:ff:ff:ff:ff:ff
    inet 10.9.16.20/24 brd 10.9.16.255 scope global eth0
       valid_lft forever preferred_lft forever
    inet6 fe80::f816:3eff:fe98:274e/64 scope link
       valid_lft forever preferred_lft forever

# route -n
Kernel IP routing table
Destination     Gateway         Genmask         Flags Metric Ref    Use Iface
0.0.0.0         10.9.16.254     0.0.0.0         UG    0      0        0 eth0
10.9.16.0       0.0.0.0         255.255.255.0   U     0      0        0 eth0
169.254.0.0     0.0.0.0         255.255.0.0     U     1002   0        0 eth0
```

Is it the same as in LVS NAT, where the gateway IP needs to be changed to the LB’s address? Also, does NAT mode support cross-subnet traffic?

**Comment by yolooks** [comment]
Additionally, the example provided in the loxicmd help output is also incorrect:

```sh
# loxicmd create lb -h
Create a LoadBalancer

--select value options  
  	rr       - select the lb end-points based on round-robin  
	hash     - select the lb end-points based on hashing  
	priority - select the lb based on weighted round-robin  
	persist  - select the lb end-point based on sender  
	n2       - select the lb end-point based on N2 interface params (only available with fullproxy mode)  
	n3       - select the lb end-point based on N3 interface params  
	lc       - select the lb end-point based on least connection  

--mode value options  
	onearm      - LB puts LB-IP as srcIP  
	fullnat     - LB puts Service IP as srcIP  
	fullproxy   - LB operates as a Layer 7 proxy  
	hostonearm  - LB operates in host one-arm mode  

ex)  
	loxicmd create lb 192.168.0.200 --tcp=80:32015 --endpoints=10.212.0.1:1,10.212.0.2:1,10.212.0.3:1 --mode=dsr  
```

My usage:
```sh
# loxicmd create lb 10.9.16.249 --tcp=8090:80 --endpoints=10.9.60.8:100 --mode=dsr --select=hash  
ProtoPortpair: map[tcp:[8090:80]]  
Error: No port-translation in dsr mode  
```

Documentation: https://github.com/loxilb-io/loxilbdocs/blob/main/docs/nat.md
DSR mode is divided into l2-dsr and l3-dsr. In my testing, l2-dsr works just like LVS-DR and requires endpoints to be in the same subnet.
So, if I want to set up l3-dsr, how should I configure it?

Additionally, another question:
In fullnat mode, how can the real server obtain the client's source IP?

**Comment by TrekkieCoder** [comment]
> Additionally, another question: In1m fullnat mode, how can the real server obtain the client's source IP?

LoxiLB supports proxy protocol v2 for this. You can check the documentation [here](https://docs.loxilb.io/latest/proxy-protocol-v2)  and a loxilb user's approach [here](https://www.linkedin.com/pulse/proxy-protocol-v2-loxilb-ali-ebrahimy-cjwde)

Meanwhile will double confirm l3 dsr config.

**Comment by inhogog2** [comment]
Thank you for pointing out the incorrect part in the loxicmd help output. I'll go ahead and fix it.

In the case of DSR mode, the mode value must be set to "hash" and the port cannot be changed.

So you should be able to write it as:

```
# loxicmd create lb 10.9.16.249 --tcp=8090:8090 --endpoints=10.9.60.8:100 --mode=dsr --select=hash  
```

For L3-DSR configuration, the IPinIP setup is included as shown in the following example. Please refer to the script below.
https://github.com/loxilb-io/loxilb/blob/main/cicd/tcplbl3dsr/config.sh
